{
  "schema_version": "1.0.0",
  "dataset_id": "NuFIT6.0_2024_IC19_without_SK_IO_diagonal_gaussian_v1",
  "source": {
    "version": "NuFIT 6.0 (2024)",
    "url": "https://www.nu-fit.org/sites/default/files/v60.tbl-parameters.pdf",
    "selection": "IC19 without SK atmospheric data; IO local-minimum best fit and symmetric one-sigma errors; pinned archive, not latest release"
  },
  "ordering": "IO",
  "observables": [
    "sin2_theta12",
    "sin2_theta13",
    "sin2_theta23",
    "dm21_eV2",
    "dm3l_eV2"
  ],
  "units": {
    "sin2_theta12": "1",
    "sin2_theta13": "1",
    "sin2_theta23": "1",
    "dm21_eV2": "eV^2",
    "dm3l_eV2": "eV^2"
  },
  "mean": [
    0.308,
    0.02224,
    0.562,
    7.49e-05,
    -0.00251
  ],
  "covariance": [
    [
      0.00013225,
      0,
      0,
      0,
      0
    ],
    [
      0,
      3.1922499999999995e-07,
      0,
      0,
      0
    ],
    [
      0,
      0,
      0.00018224999999999998,
      0,
      0
    ],
    [
      0,
      0,
      0,
      3.61e-12,
      0
    ],
    [
      0,
      0,
      0,
      0,
      6.0025e-10
    ]
  ],
  "likelihood": "GAUSSIAN_APPROXIMATION",
  "assumptions": [
    "Diagonal covariance is an explicit approximation; no measured correlations supplied.",
    "Asymmetric one-sigma errors symmetrized by arithmetic mean.",
    "Dirac phase omitted because its likelihood is non-Gaussian and periodic.",
    "No ordering preference, cosmology, 0vbbeta or global Zee acceptance included.",
    "NuFIT 6.0 publishes official one-, two-, and three-dimensional profiled delta-chi-squared projections, but not a single joint six-observable likelihood in this record. Projections are not combined because that would invent cross-observable correlations."
  ]
}
